Date,UTC Date,Submission Data
"2024-09-23","1727049600","Stock Market Mania Takes Hold Deep in Hinterlands of India
Explain
Made a model Pf What what you addremove
Made a mode Pf discussion
New to stock market
Can I readjust Portfolio on the same day
Rattanindia enterprises ltd
Indian Markets Calm Masks Chaos Beneath With Bets On RBI Rate Cut
Which screener do you guys use to identify stocks
Market and ONOE
What would you addremove
What would you addremove
Need investment advice for  lakhs
Is this stock still worth buying
Has anyone received the TATAMOTORSDVR shares after the merge
I am beginninerwhy is it showing like this
Shall i give PAN or AADHAR details to telgram channel for joining premium group who keeps giving option call
Why is it showing error
Why is it showing error
Should i buy vi
Please review my portfolio
Portfolio review especially wrt coming  years
RSIs indicating an over bought market
Monarch bonus shares credit
Nandan denim
Portfolio since  does it need a revamp
Deepak fertiliser Thoughts
Top  Richest Countries in the World in Hindi in
Review my portfolio
Which broker apps allows to place both SL and Target in intraday along with placing an entry order in both limit and market price and also in GTT Using angelone but robo order only allows to take entry in limit price and not in market price Is it possible to place sl and tgt in Angelone GTT order
Kalyan jewellers broke through resistance today
What do you guys have to say about my portfolio
Manba finance IPO
Help me keep one app out of these or suggest a better one
AVANTI FEEDS for short term swing
Newbie here Recommend stocks to invest  lakh
Apply now
Manba vs Krn ipo
OptionAnalytics for Nifty  Live MaxPain vs Spot Chart
How you guys manage track your investments Im a beginner seeking for advice
Weekly Insights A Decade of Shifting Fortunes  The Evolution of Investor Behavior in India
Chrome extension for Portfolio Analysis on Groww
Financial Advisor Training Program Traderpreneur Xcellence
Lemon Law Advice For Engine Faults With The  Chevrolet Tahoe Lemon Law
Natco pharma
Natco Pharma  to
Personal Care Services  Personal Care ndis  ndis Personal Care
Top Features of Modular Kitchens by Novella Kitchens
Explore investing in Unlisted sharesPrivate equity
Swiggy has released its FY results Unlisted Share
Is anyone waiting for a downturn before making stock investments
Tata Motors Stock
Views on Fusion Finance for tgt of
FIIs are coming back k crores nett value purchased on friday
Skipper Limited
My Perspective on NSE PreIPO Investment A LongTerm Wealth Opportunity
Order rejected
Upstox Tata Motors DVR Query
Whatd youll think about todays Bank nifty
Discussion
Order rejected
Review my low risk appetite portfolio investments over past  years
How to convert physical shares into demat
Should I switch my broker Zerodha
Indian vs chinese Stock market
Help How do I calculate yearsonyearYOY on groww
Levitra mg Sex EachOther At Room
Is EPF worth it
Is it good to buy MM or is it FOMO
Buy High Sell Low
My ten suggestions for swing trading
Got alloted the IPO of Muthoot microfin Only went for listing gains listed at a loss Should I hold or book my losses
Should I invest In Northern Arc after Listing
Confused About Investing in Nifty  ETFs vs Index FundsAm I Missing Something
HAL  today
Vodafone Idea is it green signal news
FIIs are coming back k crores nett value purchased on friday
Am I Carrying Too Many SIPs Need Opinions on My Portfolio
Can a person be in trouble after making too much money when we has in loss yesterday
What is the opinion on BHARAT  ETF
Good at current level
Is my stock portfolio good
Future of Ashok Leyland
Can anybody tell what is happening here
Long Term Investing Gems
Long term view on Bharat electronics pls
Timing the market
Enter or wait
Please suggest some best books
Which one is better according to you guys
Is it the right time to enter GAIL
FIIs are coming back k crores nett value purchased on friday
Portfolio Review
I can say now that it is working
Told ya
Immersive VR Solutions Transforming Digital Experiences
Levitra mg Sex Firstly  At Room
Best Dry Cleaners in Noida  Dry Cleaning Services Near Me
Good Time to exit or Hold
Gonna be the richest man on this sub
Best Dry Cleaners in Noida  Dry Cleaning Services Near Me
Cr  Bikes and a Baleno  Trolls The Financial Avengers Assemble  Key Insights from the Communitys Wisdom
Day  of trying to become a Millionaire
of individual traders incurred losses in equity FO during FYFY Sebi study
its not much but its honest work
Is there any chance that its GMP will decrease after some days
Alloted ipo in Northern Arc but didnt recieved any msg or info
ETF Swing trade
I am currently an intern M  started an sip  months ago of k pm want advice on the MFs i should invest in for long term yrs
PreIPO placement questions
Strategies for Successful Share Transmission
Mahindra  Mahindra
Yolo go successful
Started a year ago Feedback to grow
Stock Market  The Truth
Improve my pf
The new IPO
Can SpinOffs Really Unlock Value Story of Jubilant Industries
Can SpinOffs Really Unlock Value Story of Jubilant Industries
DM me if you want to be profitable
Losses in fno in FY
SEBI study finds  of individual FO traders made losses between FY and FY
Seeking Recommendations for the Best Mutual Fund Brokers
Did anyone here subscribed to tejimandi flagship
Beginner tips on how to grow and learn
northern arc ipo shares did not get credited
upside in PSU bank stocks likely
Option buying
JagatGuru Sant Rampal Ji
JagatGuru Sant Rampal Ji
SEBI study for FY   Only  have earned  Lakh and above
Purchase date of my holding
Help me choose mf
Im Back JK
Tata motor demerger
Northern Arc quick gains or longterm multiBagger
F    The New Way to Earn Millions
Thoughts
Investing in MF through SIP for my wife
howtocontactquickbookspayrollsupportnumber
howtocontactquickbookspayrollsupportnumber
quickbookshavepayrollsupportnumberavailable
howdoitalktoarealpersoninintuitquickbookserrorsupportnu
howdoitalkforquickbookserrorsupportnumber
interactivecontentquickbooksenterprisesupportnumber
Bhabhi lost her life while donating liver to her motherinlaws sister
Dhan vs Angel One
quickbooksenterprisesupportnumber
Arkade Developers share still not credited to my account
MEME
Enhancing Customer Loyalty through Relationship Marketing in
Suggestions for good debt funds
Kpgel KP green engineering limited faruk Patel
Help me to create a bot
Prediction for tomorrow Nifty th September
Mutiiiiii Baggerrrrrrr
Can anyone check
Short Dixon
Investments for long term  years
Planning to be SEBI registered Financial Advisor
I had  shares of Tata Motors DVR which means I should get  TATAMOTORS shares but got email for just  I got them in may only and record date was September
Any suggestions on my MF portfolio
AARTI DRUGS SWING SET UP
REASON WHY YOU DONT USE AI FOR TRADING
Karnataka Bank
How does the selling of mutual funds works in terms of long term
Dekho wo aa gya Detailed post on the Tata Motors Ordinary shares and DVR shares coming soon with heavy deep insights  I promise youll love it Drop your questions in the comments here
Swiggy preIPO
Birthday stock
Deepak Fertilizers  From commodity to speciality play
Manba Finance or KRN
MTF order
Ask me about any  stock I will give free advice on it"
"2024-09-24","1727136000","Your opinion
New stt from October or mrlo retailers ki
FnO and technical analysis
Hey folks are there any online courses for young children to learn about finance
Anyone selling picks
Annual Real GDP Growth Expectations by Country Over the Next Decade  by Ray Dalio
Rolling Returns of popular indices
Indian Investors Fret High Valuations Look East For Better Investment Returns
if stock comes near lower nd line i will buy it and set stop loss at rd ine st line is target thoughts
What trades you are making today
What to do with my Bajaj Housing finance shares
Bajaj housing finance
Bajaj Housing Finance future prospects
Automatic Selling of IPO allotted share at Opening Price
Planning to buy arkade developers post listing
Planning to buy arkade developers post listing
SME IPO  Be careful as this could be a Modus operandi for many which are getting listed
Planning to buy arkade developers post listing
Tata motors shares credited less for DVR shares
Many Benefits Of papaya
Explore Investments in Unlisted shares  Private Equity
Any sources for inside information for trading
Anyone else facing this
Help me with mf
How are fractional real estate investments
Kamagra mg Physically  Sex On Bed
Tata motors dvr shares credited wrongly and invested amount is in return amount
Full time traders what does your day look like
Market
Worst FM
Beginner
Tata motors ordinary shares allotment discrepancy against DVR shares
Dabur woken up your thoughts
Kamagra Oral Jelly Couple  Feeling Share On Bed
Why do so many FO traders struggle to turn a profit What can be done differently
Groww vs Kite for FO trading
Hi iam new here why this stock is in this pattern for last date be week the maximum is exactly  daily and   buy orders why this happens
Are gold ETFs the right choice to invest lumpsump at the moment
US Sanctions Against China To Benefit Indias Solar Exports
Fildena  Extra  Romance With Couple
Break below
Upcoming Dividend Calendar for TSX Stocks Key Dates to Watch
OptionAnalytics for Nifty  Live MaxPain vs Spot Chart
Break below
US India to setup the worlds first multichip fabrication unit in Jewar UP
Query regarding selling of shares allotted of SME IPOs
Best Best Intermot Hydraulic Motor suppliers in New York
kamagra Oral Jelly sildenafil Ip Dosage for Couple Tablets available to Make Your Ed Life Better
How can I transfer shares from CDSL to NSDL online
Vedanta stocks buy or not today
PB value Northern Arc
Query about rights issue and right entitlement
kamagra Oral Jelly Ed Difficulty Immideatly Relaxation
Target price for arkade in short term
Should you Invest
Goa Shipyard Limited has released its financials for FY Unlisted Share
BONUS CODE FOR EO BROKER  EXPERT OPTION
Suggestion
What is going on with my Zerodha
How AIPowered Predictive Analytics is Revolutionizing Stock Market Trading
Tata Motor Merger Received  leas shares
buy Kamagra mg Ed Pills Booster Sexual Power
Just want to invest anywhere
Identifying opportunities in current market conditions
Identifying opportunities in current market conditions
SIP of k per month
buy Kamagra mg Cure for Erectile Dysfunction and Premature Ejaculation
Kellton tech
Kamagra mg Sildenafil White Pill Eliminate Ed Correctly
Anant Raj is fooling BSE and NSE you will loose money if you buy the scam companies Do not be fooled by dii or your uncles advising you to buy a theme
Ge power India gepil share
Real Estate or Stocks in  Which Gives You More Profit FinancialFocusUSA  Smart Investment
Should I invest in bajaj finance right now for long term  years
buy Kamagra mg Safely Via Bitcoin From  a Verified Source at Usa
OptionAnalytics for Nifty  How is the Strongest Support and Resistance Shifting
Reality of Indian Stock Market Ignored by many
Kamagra oral Jelly
BankNifty Today  Points Profit Caught on Risological Swing Trading Indicator
AS ASKED HEREs MY VIEW ON RAILWAY STOCKS MOSTLY ALL STOCKS HAVE SAME CHART GIVING YOU  OF THEM
Should i sell arkade developer
Reliance power
Suez crisis Houthi attacks disrupt Indias diesel trade and oil business
Top Microcap or SME to invest in India
Please help how to fix this discrepancy in TATAMOTORSDVR
Sensex prediction by the end of year
Which of these following Stocks for long term
The best investment i ever made
IEX shares tumble  on reports of market coupling implementation by FY
IDBI FOR SHORT SWING TRADE
Preapplication of IPOs
Could someone explain this to me
Kamagra mg
Kaash le liya hota Monday ko lot
ONGC Videsh inks gas deal in Azerbaijan Morgan Stanley sees  upside
Suggestions
Post listing returns Any hopes
Sara  Emy
Levitra
Good entry to NATCO
Super Kamagra
Buy tata steel Future Nov
fildena
Explain me how Price deciding here
Blue Jay Pms cp nht v cho ra mt tnh nng tch hp thanh ton Blue Jay Pay
Ntpc green ipo
Vi stock
Filitra mgmg
How to learn trading
Fin Nifty
Kamagr mg Sildenafil ED Judgement At USA
Guys am i dying
Kamagra mg Highly  Increment Sexsualty
CDSL yolo as  yr old
Jagadguru tatvdarshi sant Rampal Ji Maharaj ki likhi gai pustak mangaane ke liye
Which Broker is the best for Future and Options
SIP review
Introducing My Stock Dashboard Web App  Test It Yourself
Need help with deciding sip
Kamagra mg Physically  Sex On Bed
Kamagra Oral Jelly ED Pills  Couple Connect
Northern Arc capital IPO
HDFC BANK READY FOR BIG MOVE
Pure Onion Suppliers in Delhi
Lumpsum in balance advantage fund
Pure Onion Suppliers in India
UPs first scheduled airline Shankh Air gets NOC from civil aviation ministry
Technical analysis traders how do you find stocks which have patterns you are searching for
Local Scrap Kabadi Wala Trusted Buyers in Your Area
Platforms for overlapping charts
Cenforce mg  ED Black Queary Men Health
RSI divergence
Conclusion about IT stocks
Whats the right way to transfer stocks
aurora tow truck
How to actually do analysis
Cenforce  ED  Stimuleted Men Collection
Assembly Constituency Bandipora Kashmir Elections  Nizamuddin Bhat Congress
SIP on which day
WHAT IS THE MAIN KEY YOU LIKE IN
Why Marriage Needs a New Purpose
HDFC securities
Advice for new investor investing in IPO
HDFC securities
Mark Douglas says find your edge What is this edge How does one find it
Planning to be SEBI registered financial advisor
How is this for an SIP
I M IN SHOCK WITH EXISTING AIs FEEDBACK ON MY MODEL
AlKabirIslamic SaintRampalJi
About the trading platform
Building positions on gold
Tata Pharma fund for long run
Hello guys could you all fill a google form regarding retail investors for a college project
Need reviews for the below portfolio
Im new to investing and can afford to invest k per month Im planning to put k in UTI Nifty  and looking for suggestions for another mutual fund for the remaining k Any suggestions
Indian stock market scam
TradelikeBerlin
Sharing a long term success story
Todays profit
How can I buy Chinese stocks
I am confused on my trade Pls help
Bullish On KFIN Technologies Again
Bullish On KFIN Technologies Again
MY VIEW ON RAILWAY STOCKS MOSTLY ALL STOCKS HAVE SAME CHART GIVING YOU  OF THEM
Im confused about my position seems like I screwed up
Need suggestions for lump sum investment
Thoights on this
How to fix this
Thoughts on this
MTF orderplz help
Need help in improving setup
BIOCON  Swing Trading Buy Opportunity
Can u suggest me some better penny stocks
BIOCON  Swing Trading Buy Opportunity
PF or Blue chipsIndex Funds
Whats this Please explain
Will it rise
Can I set pre market order for ipo in groww
Should I buy
Can this stock become Multibagger because everywhere I see is Crane Crown Lifters ltd
Can I hit cr
are we expecting more upside Paytm
HDFC finally at a reasonable xirr
HDFC finally at a reasonable xirr
Zero hero trade Capital ki kumi
You can still grab this opportunity
SIP Review
Shriram Finance
What happens when share gets listed at lesser price than unlisted share
Any chance of recovery in fusion finance
demat acc probem
I got allotted with Bajaj housing finance IPOso should I sell or hold it for long term
some advice
Why PNBs price is going down
Index or large cap
Dvr to ordinary TATAMOTORS
Views on this
Can Someone Explain These Terms in Big Investor Portfolios on Moneycontrol
Can Someone Explain These Terms in Big Investor Portfolios on Moneycontrol
Can Someone Explain These Terms in Big Investor Portfolios on Moneycontrol
Can Someone Explain These Terms in Big Investor Portfolios on Moneycontrol
Views on this
Have you ever tried algo trading
Opinion on First Cry
Best Stocks to Watch for Options Trading
howdoicontactquickbooksdesktopsupportbyphone
Another IPO
Xero Central
Which stock broker has the least brokerage Groww Angel Zerodha or anyone else
What happened to JFL Life Sciences
Xero Central
Why Bel is a must have gem in your pf
marketsmojo Stock of the week account transfer
Should I exit my MF for current time and reinvest it after market comes down
How to pick stocks for swing trading whats ur strategy
Need Help
What constitutes as a good XIRR
NEED HELP
Hyundai ipo
Hyundai ipo in October
Waaree Renewable stock price soaring
Hyundai IPO
Suggestions needed for choose brokerage firm
Thirteen Pandas
What should I do of the balance
What should be sl and target is it good trade
Guys help just started investing yesterday buying these for long term help and recommend me some stocks plz
Please Review
why cant you scalp with an IRON FLY   on intraday
IoT Device Management Market size was valued at USD  Billion in  and is poised to grow from USD  Billion in  to USD  Billion by  at a CAGR of  during the forecast period
LED Driver Market size was valued at USD  billion in  and is poised to grow fromUSD  billionin toUSD  billionby growing at a CAGR of  during the forecast period
Is it possible to earn money without investing
Will bank account name mismatch cause me any IPO allotment troubles
stock
Want to reach cr net worth in next two years
Vedanta Limited  Deep Dive
What are the fundamental concepts and strategies of intraday trading and how can a beginner effectively utilize them to minimize risks and maximize profits"
