Date,UTC Date,Submission Data
"2024-09-01","1725148800","SANT RAMPAL JI MAHARAJ YouTube Channel
Gift stocks
Technical Analysis Discussions
New to investing  only  yr
SHOULD I HOLD ORIENTTECH
Gala Precision Engineering IPO
Best strategy for swing trading long only
Retailers vs banks
Many Benefit Of kishmish
Vested vs Indmoney for US stocks
Help Needed With RHP
Guys got premier energies ipo
Never forget
Worlds Strongest Crane Unveiled
SWIGGY UNLISTED STOCKS VALUATION
Semiconductor process companies in India
year into this review and suggestions welcome
Payment for IPO Failed  I got allotted to premier Energies IPO but due to Axis Banks servers being busy this morning my autopay could not be completed What happens to my allotment now
Dhan VS Fyers
Which firm provides stock recommendations for swing trading
If you had to bet on just ONE stock today what would it be
Opinion on these
Stock Queries
Outstanding Litigation as shown in Red Herring Prospectus
Ask your Stock Queries
Help
Analysis on TATAMOTORS
image processing failed
Discount Coupons for Shareholders in Oberoi  Trident hotels
Portfolio Review
No STCG for investing in US equities for a person who falls under taxable income
Hpl dividend
DONT POST SHIT
IPO non allotment reasons
Regarding Mobikwik lending business
Please help
Why are dividends not credited directly to my bank account
Wtf is this Crorepati in a day
Icici dividend
What should I do with TATA MOTORS shares Hold or buy more
Which stock you regret selling  And at what price it is now
After  years it will be Multibagger  whats your opinion guys
month profit
hindalco swing trade lookin finei am new so open to criticism
Can I add my fathers securities on my angel one account
what do you think about my techincal analysis on hindalco as i am new i would like some insights on what is did wrong or right i choose hindalco after looking at the fundamentals and technicals
Unlisted shares
Stocks under
Premier Energies IPo
The Ultimate List of Best Books for IAS Preparation in
Why Zomato founder deepinder goel owns only  percent in Zomato
First milestone L
Need advice on safely investing  of my parents money
Best Short Sell Trade for Monday
First milestone achieved L
What do you think of IT Sector in coming  years
Quant small cap MF
Suggestions on arbitrage funds
Morepen laboratories
CAN INDIAN TRADE AMERICAN OPTIONS
My NIFTY  Analysis
How to invest around L
Please share your views on this This in front page but still please do review
Last month swing  trades profit
Dhan logic behind profit calculation is ridiculous pls correct me if im wrong
Reliance Bonus Share
Hold sell or add scilal
Struggling to Keep Up with Stock Market News  Whats the Fastest Way
Is it a Good Time to Start SIPs at Market ATH
How Are Markets Meeting Record Mutual Fund Inflows
My IPO love story
Please review my portfolio
Is it necessary to define Max loss per day and fixed target per day for an intraday trader to sustain in the long run
Any thoughts on this PF Investing  onwards regular SIPs with increasing amount Current invested lakh total is  cr XIRR  Invested for long term current age  looking for retirement and wealth generation by
Investment Dilemma
Is investing in mutual funds through bob world advisable
Need Help To Raise Funds For A Business News Media Company
Anybody invested in thishow come its downbonus date on
How to learn Option trading like an enthusiast not a gambler
Does ETFs have expense ratio If yes then how can I know the exact ER of NIFTYBEES
Next multibagger
Need advice
Should I sell these and buy equity stocks
KOI BEST MUTUAL FUND BTAO  YEARS KE LIYE
Planning to buy Zomato for short term months What you think of this stock
V Retail Share Discussion
Oh wise seasoned investors Help a up and coming newbie
Choppy August   ROI
Short term trading
Help a yo out
Forex Trading
guy
Please rate my portfolio
Transferring funds from one platform to another
Mutual fund with low AUM or High AUM
Order now
Stack Recommendation for a Trading App
Need suggestions on my investment
Is it fixed that if a stock is approaching its bonus sharethe stock price will increaseegvst shares
Need help Zerodhaa vs Dhan
ganpati bappa ganpati
where i would  recieve my money
Are Markets Overvalued now and is a Correction on the horizon
Should I sell my shares in ola
Need a Listing day strategy
What should I do next
Any major stocks poised to go down this week
Futures Trading with no stop loss strategy Anyone else followed this strategy
Being beginner
What are your picks for September FnO
Is this a good choice for a year SIP of k per month
Portfolio Review Please
PSA Bluechip funds include Nifty Next  as well hence not the perfect comparison to Nifty
Portfolio Review Please
Planning To Start My First SIP
Dhan vs Groww vs Indmoney vs AngelOne for FnO
Need Advice from the PROs
How to invest in GST
Starting portfolio
I have done a small course on stock market and got some insight into SMC concept however want to know more on the monthly expiries and what strategies they use I know its a risky game and I have Premium membership for some option calls But I would like to learn it myself
How to multiply money
i have  lakhs should i invest for long term or do swing trading
TATA MOTORS BUY NOW OR AFTER THE DEMERGER
Starting my stock market journey at
Poor portfolio  hence requesting for MF review
Doubt regarding ISR form
How much diversification is needed for a capital of about k
Learning to Trade from a Mentor
Learning to Trade from a Mentor
Learning to Trade from a Mentor
Learning to Trade from a Mentor
Advice for long term mutual funds
Suggest books on fundamental analysis
Where to invest k monthly
Want to Learn
Please suggest some stock which are possibly going to be multibagger in future
Grass project
So what moves the stock after all
Investment for kids"
"2024-09-02","1725235200","A call to young investors
I know PE isnt everything but surely this is not sustainable
Nifty Prediction for Sep
Exicom
Hold or sell
Exicom tele system Itna down kyu ja rha he koi idea
Guess who bought Suzlon here
Ok
Bhai ye kya hai
New to stocks but need some assistance Where to invest
Many Benefits OF Kaju
Is there anyone whos investing in Gala precision engineering IPO Should I invest in it or go for Premier energies
Perfect pyramid doesnt exist
Upcoming IPOs in Indian Market  September
Where do I get money to invest in stock market
Stock reccommendation
Hotel API
Anyone Else Redeeming and Reinvesting Mutual Funds Annually
How do I know if a mutual fund is offloading a stock on each day
My Investing Journey with One Particular Stock L Realized L Unrealized Profit
Portfolio Review Please
Ola Crashing
Idfcfirst bank demand is up
Anything I should let go or add
Adani gas sell or buy
Portfolio Review Please
Any recent brokerage action upgrade for an Indian company
Name one small cap  cr Market Cap idea that you are most bullish on along with one line reason for the same
What is this I didnt receive any money
Portfolio Review Please
How can I link my zerodha demat account in the Kite app
How can I link my zerodha demat account in the Kite app
When should i buy OLA
OptionAnalytics for Nifty  Live MaxPain vs Spot Chart
LG Electronics weighs India IPO to help chase  billion goal
You can easily short Bajaj Finserv if it somehow touches  today
Angelone Authorised Partner Yashvi Investment
Rate my portfolio
Barium Bromide Manufacturing Plant Project Report  Setup and Cost
been investing since i was in grade now in grade  does the portfolio look good booked approximately k profit
Stock suggestions
Should I invest
Time to sell INOX india
Bank Nifty Trade Today
Fellas how bad is it
Cochin Shipyard  down
Please reveiw my MF allocation
Please review my Portfolio allocation
Review my portfolio guys
Help Needed Converting Reliance Petroleum paper Shares to Demat
Any one can help me
This question is to people who doesnt have much knowledge about stock market or trading but still invests some amount in stocks  not smallcases and Mutual Funds
OptionAnalytics for Nifty  How is the Strongest Support and Resistance Shifting
nifty will close in red today If it doesnt by any chance PE leke jao  days positive Correction pending easy money
Is it good
Only  months Exp Please rate my portfolio
Index Funds Only  months Exp
Sarveswar Foods  Thought
Help Me To Invest in Better Way
Portfolio review should I stick to mf  years old
I have  lakhs to invest how do I proceed with investing this amount
IREDA
Zomato and BEL accumulation
Whats up with Adani Power
m investing since
SWING TRADING IDEAS FOR SEPT SERIES
how do i get rid of the non tradable symbol in dhan app
Half life time saving in Ducon infratechnologies
Any feedback for my portfolio
SOIC membership share
Strategies for Successful Share Transfer
Want to invest  k in mutual funds where should i invest
Bought Gravita stock at the peak
This weekend the whole industry going to be change
Someone please help me cover the losses
Should I hold or sell it
First time shorting experience
Newbie in stocks
Premier Energies Limited IPO Key Dates and Investment Details
Okay what just happened with jio fin
View the Latest Motorbikes at the KTM th Mile Showroom
I am planning to do  lakh per month sip review
Fun On Dirt Road Trips Is Perfect for the KTM  Adventure
The Bajaj Pulsar NS s innovation and performance
View the Whole Collection of Pulsar Showroom
HDFC volume on th sep
The KTM  Adventure X Will Rethink Your Adventure Rides
Classic Indian Mobility Icon Bajaj Chetak
Incredible Power Shown by Pulsar NS  Mileage
City Electric Motorcycle Chetak Urbane Ecological
Svartpilen  A Stylish and Robust Urban Explorer
Vitpilen  Vintage Style Blends with Latest Innovation
Hdfc volume on th aug
Chatbot AI Revolutionizing Customer Service  Business Automation
My first investment Im student and using my pocket money so small capital
Rate my portfolio
anyone who is confused what topics you should learn before you start trading Go check out my video
IPOs allotted August is crazy
Vedanta just announced  rupees dividend
NAV issue
Nav issue
Buch is talking up an SIP of Rs  as an innovation Nippon has allowed SIPs as low as  since at least the last  years Navi allows SIPs as low as Rs  And these are not the only AMCs to be offering sub  SIPs
This is our aware impartial innocent regulator
Sell or hold or sell and buy again on dip Please give me suggestions
Got  Lakhs to invest in this month looking for options
Mutual Funda
How I Avoided Being Fucked by the Market
Advise for Inexperienced Bull Run Retailers
Need guidance
Does the recommendations given by economic times or sbi securities actually work
Roast my portfolio
Help me re invest
Absolutely getting cooked in the past  months Please suggest what to do
Is cash transferred to our bank or Groww balance after selling stocks in Groww
Multibagger stocks
Multibagger stocks
Which MF or ETF should I choose for Onetime SIP
Has anyone tried trading in Commodity Market
Kalyan Jw gave profit of  till date What would be the right time to exit
GTT order query
Should I buy premier energies
Buying NSE unlisted shares from broker
Zomato  promoter holding
Understanding Market Rallies Is It the Real Deal
Need advise
Chart Analysis
Hindenberg Con Propaganda Fall Flat AGAIN
India Will Become A Vis
Shoonya by finvasia only total free platform
Alogo trading
Portfolio Review What to do do next
What is your opinion on jiofin
Portfolio Review
My Multibager
Shall I keep holding
Little help for a newbie
When do you sell
Case Study of Modi Rubbers Financial Facade A Deep Dive into its True Earnings
Can someone explain new sebi rules
Please suggest a mutual fund for decent returns
Need Suggestion for MF
Indexing How good is it
Suggest me some good mutual funds for monthly k investment
Good Start to September series
Need help understanding this mail
Nism Securities Market Foundation series XII
Should i book premier energy listing gains
Groww fund balance
How Sebi New Directive Will Impact FPIs  Custodians
What is the view on IRCON My average is
requesting rIndianStockMarket
Investing since  months but still lagging the index Should I move entirely to MFs
Vedanta bound to increase dividend announcedjust want to know your experience
Jio finance
Anybody had watched Netflix series called EAT THE RICH is anything happened like that in India
I am very confused about Trading Intraday or Swing Which one best
Ecos Mobility IPO hold or sell
OLECTRA GREENTECH
Allotment is out
Suggestion about stock market and trading
Portfolio review
Need Advice on ETF
Stocks to buy
Swelect Energy Systems
SAIL  Should I buy more to average or cut losses
True AF
Gave this crucial Nifty level in advance  Watch for Tuesdays FO analysis
Highest RMS Charges by Mstock
VALUATION
Suggestions in Portfolio
Shares to buy on Tuesday
Residential Solar Panel  Battery Installation  Contact Us Today
Kalyan Jewellers Share Price Target  Kalyan Jewellers                   Target Price"
"2024-09-03","1725321600","Portfolio Review Please
M Lmonth SIP breakdown advice
Planning to invest  L today
When youre allocated an IPO and aiming for listing gains how do you determine the selling price
My Nifty Mf need portfolio review
How many lots should I apply for
Varun beverages limited
Anyone getting the same error
A stock for PS
Noob investor seeking advice for SIP of k
Many Benefits Of avacado
Baazar style IPO review Is Jhunjhunwala backed issue worth applying
Premier Energies
When ti sell premier energies listing
Views on ECORECO
HELP FOR NEWBIES
Multibagger stocks
SWP vs NPS Which Retirement Plan is Right for You Including Tax Implications
premier energies IPO opened at
PREMIER ENERGIES SOLD Or Holding
Why gold etf have different return and why they are not following gold price
PREMIER ENERGIES Day  SOLD Or Holding
Financial calculator calculations
Short term xx stocks
Godrej Reserve Mumbai
IPO Investing Risks and Rewards of Buying New Stocks
Nifty momentum top   Week
OptionAnalytics for Nifty  Live MaxPain vs Spot Chart
Yesterday I sold my mazagon and Cochin
Maior Solutions  Best Branding Agency In Calicut
Why this company is constantly rising
Multiyear breakout in Baroda extrusion ltd  year long cup and handle pattern
Maior Solutions  Best Branding Agency In Calicut
MaiorSolutions  Best Branding Agency In Calicut
Multiyear breakout in baroda extrusion ltd  year long cup and handle pattern
Future copper demand in renewable energy sector
Epack Durable share
Any Alternative
Premier Energies IPO
Any Alternative
I am also came in buy high sell gang  Plz kuch suggest kro kya kare
IPO Should you apply or not
IPO Should you apply or not
VARUN BEVERAGES LIMITED
Is participating in an IPO more likely to become a valuable asset that enhances your investment portfolio or could it turn into a burden due to potential risks and market volatility
What is IPO in the stock market and when does a company go for an IPO
IPO Should you apply or not
How high will we push our stock market and for how long
Unexpected high volume for nifty in last  minutes
Should I continue my smallcase
What yall feel about this Im up
Should i invest in yash management and satellite
It near breakout and news is also supporting the technical charts
Guys I sold union bank of India today Tomorrow it Will go up
Suspicious Call Claiming to Offer Stock Market Tips  Possible Scam
Is it worth investing in Gala precision engineering IPO and Baazar Retail IPO
Help
Is it worth investing in Gala precision Engineering and Baazar Retail IPO
Wonder if we would get NSE IPO
Wonder if we would get any shares if we subscribe for NSE IPO
Views of Titagarh railsystems
BAJAJ HOUSING FINANCE UPCOMING MAINBOARD IPO ALERT
Views in PharmaBees
Hi there this is the st time I got IPO allotment on Zerodha which I sold for listing gain Can somebody explain why its showing a fluctuating Total PL even though I have sold all the shares
Govt lines up  cr to boost farmer income How will these changes impact the sector
OptionAnalytics for Nifty  How is the Strongest Support and Resistance Shifting
Why
Marutis aggressive dealership expansion is catching attention Could this be a strong indicator of robust growth potential
Aadhar housing finance
What is the future price predictions for Amaraja Batteries for Buy price in Range of  Rs
What is the future price predictions for Amaraja Batteries for Buy price in Range of  Rs
Kindly help me understand
Who buys stocks at ATH
Apply online campa cola dealership and distributorship
pply For campa cola dealership  Distributorship
Apply Now Online
httpscampacolabeveragwebsite
Campa Cola Head Office Number
Apply For campa cola dealership  Distributorship Campa cola Franchises Business
Today it has established  as one of the most popular soft drink brands
Query regarding Bonus Issues and Record Dates
With Kaynes SemiCons new  Cr OSAT plant aiming to produce  billion chipsyear and global tech partnerships in place how do you think this will impact Indias semiconductor industry and investment opportunities
I have L Should I invest or save
Secrets of a Pivot Boss  Is this book helpful
Portfolio review
New to stockmarket Where to look at
How do consumer preferences within this segment differ from other segments
social media app developement company
WHat do you prefer an IPO or a listed company
Please rate my holdings
Please rate my holdings
Is there a way to find the offer price and the listing price of a stock that was listed long ago
HAL pushing up at this situation
Suzlon Are they manipulating their profit earnings as they are just fined k Cr GST by TN govt
FINNIFTY
Need advice on investing in gold
Riding the Markets Dick
views on RVNL and Prudential Sugar
Portfolio review
Portfolio review
I always ruin a good day by over trading
Chd gaye guru
Groww will not grow
Help me invest  lakh as a  year old
It seems Retail investors are thinking more long term than noninstitutional investors or even Banks
Guys can someone tell me whats happening I tried selling the premier energy stocks but it got added to positions sell order I basically have no idea about how fno works Pls help
santrampaljimaharaj
Thank you anonymous
Gujarat accounts for about  of the total investor customer base but they account for  of IPO participation in both retail and HNI categories IPO flipping trading in the Gujju genes
Im new to the Indian Markets some of these Sebi regulations seem annoying
Can you guys suggest me some good small case managers
Aurogra  Essential Provide  for Ed Solution In Men
Biggest loss in a single day
Premier Energies IPO Listed at  with a  Gain then Dropped  by EODWhere Do You See This Stock Going
What will be the impact of restricting FO on retail investors  How will this impact swing trading volume and the economy
NonCarbonated Soft Drinks Manufacturing Plant Project Report
Bank account experience
Approximate Moving Cost Calculator  Moving Ally
Premier energies stock after listing
Premier energies stock after listing
is buying in pre open market of an ipo really worth it
How Glitch
Looking for some penny stocks
SGB
L liquid cash  Buy gold jewellery or invest in MF for long term
Bharat petroleum
giveaway from eos coin
K SIP suggestions
Undervalued stocks for long term
Is this request legit
Ive invested L in AADHARHFC for x gain in longterm and  in short term
Gold Loan in Chennai Instant Cash with Low Interest Rates
Gold Loan in Chennai Instant Cash with Low Interest Rates
Mutual Funds SIP Review
Gold Loan in Chennai Instant Cash with Low Interest Rates
Investing in US stocks
Retrodrop from blockchain
My money is stuck in Indmoney
Retrodrop from blockchain
Indian Railways is accelerating Kavach implementation to boost train safety What are your thoughts on this major safety upgrade
Upcoming Bajaj housing finance ipo How to apply as I have bajaj finserv shares so I get better allotment chances
Retrodrop from coin
Spandana Sphoorthy Finance Next Multibagger
SEBI chief received more pension than salary from former employer ICICI Bank alleges Congress
Why is Groww app showing Walmarts February  share price at   when the stock never even reached  in their lifetime
CDSL suggestions
Why is Groww showing Walmarts Februrary  share price at  when the share never reached  in its lifetime
Ecos IPO hold or sell
FOMO on seeing other portfolio
How to convert paper shares to digital
Big HNI vs Small HNI IPO Allotment Which is Better
Selling ways
Job milega
What to do with my portfolio
Money not received and app is not replying
Market showing strength
Portfolio flex
Yadupriyam Mehta on Instagram DONT BUY OLA SCOOTERS
I bought my ola scooter in the month of April and the scooter has broken down  times till now They dont have spare parts in their service centers and more than  scooters are lying because of various problems olaelectric bhavishaggarwal
I am a student  and want to begin my investing journey
Need suggestions for IPO for listing gains only
Xhud gye guru
Need recommendation for SIP
Quant large cap and mid cap
Need investment advice
Just following my passion
Conclusion about FMCG stocks
Groww Account Opening query
How to trade in FOprofitably of course
The reason behind the upward trend in most of the top gainers around the same time
sip advice
Should I make any changes in my MF portfolio
Warwizard EV
Confused with proportional allotment
What is the best platform to search for stocks
Advice needed
I have bought ola stock at  and CMP is  around  loss Should I sell or hold it I am swing trader so I cant hold this stock for years
NsE launched New web site
Seeking Advice on Improving Financial Health and Building My Own Legacy
Missed Out on Pandemic Penny Stock Boom Share Your Stories to Fuel My FOMO
Taking Loan for Trading"
