Date,UTC Date,Submission Data
"2024-09-10","1725926400","ETF Investment In Hindi
IPO applications query
Can we emulate Sweden
Will this buy me a Porsche one day
Tata motors and IRFC
Parag parikh flexi cap fund
and  Sep
Retail investors to be taxed for share buybacks
Ipo mandate accepted for cancelled application
Views on IDFC for mid to long term
Kite down
Confusion regarding cutoff time in Zerodha for Mutual funds
How to change payment option in Groww
Master Personal Finance A Simple Guide to Educating Yourself
I have bought Lancer container stocks
How long does it take to receive a UPI mandate for an IPO bid
How to sell Aarti drugs in buyback
Many Benefits OF shetut
Cenforce
Groww Scam  BHF on Hold
Should I read Al Brooks books for price action trading
Cenforce
Diff in Underlying  future contract price
My portfolio
Cenforce mg
Bajaj housing ipo share holder quota
buy Aurogra Cheap Quick and Simple Delivary at Home
Need help in understanding future potential
OptionAnalytics for Nifty  Live MaxPain vs Spot Chart
GST Council may consider imposing  tax on payment aggregators for small transactions up to Rs
GE Shipping
aurogra  Mg Ed Pills Couples Are  Satisfied on Bed
jodi satta king
Does swing trading can beat long term investment return
Wtf happened today why this much selling pressure
aurogra  Best Deals for Ed Today Onwards In Usa
Stocks that can X in  years Your one best prediction with reason
What should I do
Everything You Should Know About American Cuisine
Need help in tracking blocked amount in bank account
Market is up but a few stocks are falling down Why is it happening
How many of you have still not received the Upi mandate for the ipo because of the blessings of our brokers And Neha and Deepa arent helping
Are you looking for a reliable and comprehensive CCTV solution provider in Ernakulam
What does a realistic day in a life of an investment banker analyst look like
Bajaj Housing IPO  How do you think this is gonna do
MON   Tracking error
Stop options trading
Commercial kitchen equipments
How much you have lost till now be honest Ill go first
How much u have lost till now i have lost L in  years
OptionAnalytics for Nifty  How is the Strongest Support and Resistance Shifting
After  days of Learning Watching and carefully minimizing risks Booked my first profit in Options Trading Made impulsive mistakes but still wasnt too overcorrective
QUESTION RELATED TO HNI INVESTMENT IN BAJAJ HOUSING FINANCE
Would you like to share your thoughts on recent th GST council
Before applying for IPOs what factors should one look for
Save yourself from getting in to big trouble by options trading
groww or zerodha
Lets Go
Advice needed
What are your views and strategy if allotted
Are there better stock recommendation platform compared to Waya  with better conversion
Tolins Tyres IPO or Kross IPO
IPO Allotment
buy Cialis Online romannia
Portfolio review please
From my anlysis
Trading for Beginner
VBL
cialis mg Order from romannia
Any thoughts on this stock why its is falling
BizBrief  A financial news aggregator with minimal light weight UI
buy Original Kamagra Online In Oregon Usa
Applied for Bajaj Finance IPO did a mistake then cancelled it and Applies again Now GPay have block my money for both the application What should I do
Is tomorrow the right time to buy cdsl Or will it fall more
Best Investment Strategies for  Need Your Recommendations for Smallcases and Mutual Funds
Has Anyone Tried Using a Personal Loan for Swing Trading Looking for Insights on Risks and Downsides
Best Investment Strategies for  Seeking Recommendations for Smallcases and Mutual Funds
Where to park money when waiting for buying opportunity
Best Investment Strategies for  Seeking Recommendations for Smallcases and Mutual Funds
Call Option CE CF Should I hold or sell
Buy Cenforce pills Online Romannia
SIP REINVESTING
What is stock market
What happened to Brightcom Group Will it go up
Adaani ports any chance to grow up
Which is the best pharma stock to buy and hold for long term
Groww support is impossible
Saw this on twitter Is this even possible
Buy Kamagra Online  Kamagra Jelly Romannia MD
How many of you got this
image processing failed
cialis Tadalafil mg Top  Ed Tablets romannia
I hope reading this book will make my portfolio green
Senior level recruitment consultants India
Buy Cenforce Online At Lowest Price Romannia MD
Needed some suggestions on stocks
Its too simple  not easy
Its too simple  not easy
Stock Market
Kamagra mg For Sale In Romannia MD
Its too simple  not easy
Its too simple  not easy
Its too simple  not easy
WARDWIZARD
Why is the Market confusing so much
What up with gennex
Ed Medicine  Vilitra   Romannia
Whats up with Vodafone Idea
Sensex Financial Ratios plus Sensex  PE Vs Nifty  PE
Upi limit and IPO amount
Looking for Historical MWPL Data Beyond Just CurrentPrevious Day
Additional Resources for Fundamental Analysis
Additional Resources for Fundamental Analysis
How to intraday Nifty options
Trailing stoploss for position in zerodha
What Are Your Views On IRB Infra
Need some clarification
Any views on this
Any Young Indian traders out there like me
FnO  When Trading Feels Like Gambling
IPO DOUBT
Needed help with investing
MF suggestions
Bajaj Housing Finance IPO Analysis
Urgent Dhan deducting money for reason unknown to me Help
rad
what about central bank of India
httpswwwzeebizcomcompaniesnewsbuchledsebiitsfriendsenemiesseriespartthestoryofquantmfssandeeptandonafixertheirnexuswiththeregulator
Ethanol Musk
What do you think about waya
Need advice on Bajaj Housing Finance IPO
Deep Value Investment
Which Stock you are stuck in
What To See In Stocks Fundamental
POCL Future
Maithan alloys has  lakh shares of nse
Maithan alloys and its investment
Hi
How To Analyse Fundamental Of Stocks
Doubt regarding IPO Subscription
OLA Electric share
What do you think about waya
KYC issues in PPFAS
image processing failed
Can i modify and increase my allotment amt for bajaj tomm
Mishtaan Loss Help
Please review my portfolio and save me if Im doing something wrong
What happened to SCILAL Anyone holding
Modular Furniture Flexible and adaptable designs
Some Doubts regarding Bajaj Housing IPO and how IPO works
Recommend stock
Stock Fundamentals Analysis
Please help me with Bajaj housing IPO
Which is the best pharma stock to buy and hold for long term
I got  rs from my grandparents for my birthday and i would like to invest
Fun
Swiggy vs Zomato
Stock Suggestion on IRB Infra and NHPC
Rate my portfolio
Strategy concept for stock options
My son is  I have  lakh to play around with what should be my plan to secure him a good future
Strategies after getting IPO allotments with  premium
Mutual Funds SIP
khichidi portfolio
Annapurna Swadisht
Should I exit quant MF
Why is ONGC falling suddenly
Gensol Engineering  Potential Multibagger
I want to focus on investing in ETFs rather than Equity Suggestion needed
Anyone holding these
Option traders Broker Portability  NoCode Strategy Development
Is any one paying for a equity research subscription Like equitymaster
Bajaj Matrix
Matrix
Would it be possible to do NSDL  NSDL share transfer completely online just like CDSL
Trading Like Youve Got a Pair Why Playing It Safe is for Ps
Portfolio Review
I just started investing in MFs please review my portfolio and suggest new ones to add or remove
ASBA Application mistake
newbie loan against mutual fund for buying mutual funds
Small case exchange
In dire need of help from someone professional
EUs Antitrust Crackdown Apple and Google Hit with Massive Fines
Am I getting divided or anything I am new in the stock market you can mock me
Is my IPO placed successfully"
"2024-09-11","1726012800","Which stock you wont sell from your portfolio  hold as long as you can
Any thoughts on this stock why its is falling
Which stocks should I offload
Lakh Rupees
Please suggest what to do
A must read
Can i sell sme ipo in pre market on groww
Parking Profits Until Market ReEntry
Whats your view on Jio Finance for long term perspective
months and just  return Am I doing something wrong
Whats your take on  MIC ELECTRONICS
I think I am too diversified with the small capital I am invested with What are the mutual funds I shall withdraw from Any other recommendations
Tatamotorsvr
Who is the Hyderabad based woman that is part of the investigation into Quant AMC front running Investigation
Anyone explain what is this
First time portfolio has entered red a little jittery rn lol although most my stocks are large cap
Why is the sudden pump in Vraj iron and steal
Sell tata motors news
INFIBEAMBE what happened to this stock showing NA in portfolio
Suggestions
Consumer portfolio smallcase of Niveshaay
Many Benefits OF Mungfali
About TCNS Clothing shared
Tata motors going down Whats the big deal
Whats your opinion on Pocket Option
Asian Paints Stock Options
My Portfolio Analysis
Tata motors
Tata motors
How to modify IPO subscription in SBI netbanking
website development company in ghaziabad
Tata Motors
disawar gali
First
Made my first
Where will this stop
Ipo lot allotment of more than one lot
OptionAnalytics for Nifty  Live MaxPain vs Spot Chart
Tell me what stocks I should buy so yall can short it
cute corgi dog plush toy
Is it a good time to enter in these two
What advice would you give to me
Paytm
Top Quality Manufacturers of Spiral Ducting Systems
Review My Portfolio Please
Money didnt get credited
CLSA downgraded asian paints
How much does PMS Companies offer as hurdle rates and what are the operational costs required to run a PMS Company
Portfolio review
Studds Accessories Unlisted Shares FY Results
Market is a Mystery hole
This was not a good bet lol bought gala precision engineering ipo because did not get ipo allotment
Whats Happening
Which stock to invest in
Long Term Portfolio analysis
Oil Stocks Bull Run Over
ONGC buy opportunity
Should I hold for longer  Advise
The BS around data center stocks
The abs bs around oriana power
Which stocks to remove
Will Kansai Nerolac hit  in short term
Need advice on my SIP Portfolio does it look solid
PSA  If you are looking into SME stocks promoters are using AI Generated images of imaginative products on their website to lure the retail investors
Lets Share Our Entry Rules for MonthlyBiMonthlyQuarterly Positions
Unpaid quantity on Angel One
Raymond Split
IPO mandate from a diff bank account
OptionAnalytics for Nifty  How is the Strongest Support and Resistance Shifting
Should I exit from this trade or Hold
Flight Module
Is my mUtual fund portfolio good enough for long term  Can take risk as I m govt employee and also investment in nps All are step up sip with   increase per  month any suggestions welcome
Is Suzlon entering Stairway to heaven or hell phase
I think i made huge mistake
Financial literacy  investments and stock market
Which of your small cap stock can become multibagger in future
cr worth of retail money has been bid for IPOs this week
tata motors
Hey guys Im new to stock market
ARE SME IPOS HARD TO SELL ON LISTING DAY
Thoughts on this
Need advice on Tata motors and IRFC
Zomato service has gone to dogs and Blinkit also had head winds coming
Suggestion on replacing Index fund with Large Cap Fund
Not getting Mandate Request from Zerodha
Suzlon hold or sell
None of you without exceptions will be able to beat index over the next  years
The only dip i am interested TAMO
One doubt on shareholder quota
Tata Motors  Sep
Video Case Study on KPI Green
Stock AnalysisScreeningRecommendation app
Advice on what to sell and hold
Canara  IRB
to invest
NEED expert REVIEW
Opportunity to buy
Today profit in the profit with the capital of just k and now Im on k
Hold or sell
Mahindra Denies allegation of Bribery Says Appointment of Husband  years prior to SEBI chiefs Own Appointment
Best forex trading app and sites in India
Best forex trading app and sites
TATA Motors
How to find purchase date of really old shares
Why is it falling
Should I hold or sell
Anyone aware how a TRI ETF different from a regular ETF Does it indicate more stability or more growth
Any suggestions Planning to sell Ola
Is  lot guaranteed for Bajajhfl ipo under snii category
UPI mandate not recieved before  pm  what should I do now
where can i find the top best software developer
Is LT or LT technology a good buy
Learn top strategies to grow your worm faster and dominate the leaderboard
Didnt get UPI mandate request till  pm for Bajaj housing finance ipo
An additional way of income that does not take much time
Bajaj housing finance ipo bidding closed but yet to get mandate
Make it make sense  Tata Motors drop
Kindly review my portfolio and save me if Im doing something wrong
Stock Selection criteria and  deliberation upon Diversifcation
Stock Selection criteria and deliberation upon Diversifcation
Kindly review my portfolio and save me if Im doing something wrong
Stock selection and diversifcation
What happened here
Stocks Gives dividend  timesyear
Biggest Regret of old money
Whats up with Premier Energies
Is there any way to guarantee allotment in ipos on lottery basis
Bought Premier Energies share not regretting
Bought Premier Energies share not regretting
Mandate
Is there a point of me investing more money from my pocket into mutual fundscr portfolio
Here we go again
Here we go again
Bought this  stocks for BTST Whats your view
IRFC and CDSL
Anyone here who made over  CR from the Indian Stock Market Share your experience and this massive achievement
Review Portfolio
Please review
Groww fucked up for Bajaj housing finance IPO
Unable to approve IPO mandate using UPI
Please Review my portfolio  Im not a hardcore stock Market investor I try to put in money whenever i have it or feel like it
Please Review my folio  not a hardcore trader
HAL prediction
Varun Beverages stock jumps  on stock split record date Should you buy or sell
I screwed up
Whats your view on Infibeam avenue
Track record of UBSs Tata Motor sell calls
Only for Learning purpose
Physical Shares Of Reliance from  A Little Help
Raindroprdpcom
Any possibility of NBCC going above  soon
Roadmap to financial freedom for a  year old
This is business
Whats are some of the smartest marketing strategies used by BlinkitZeptoInstamart Quick commerce in India that made them successful
Portfolio Review
Track record of UBSs Tata Motor sell calls
Portfolio Review
i only got this message today at  pm so will i not get the ipo alloted for me first time ipo applying pls help
i only got this message at  will i get the ipo alloted
Whats happening with Ashok Leyland Its showing too much movement for more than one month What would be the best price to buy it Some experts say that it will fall more till  I guess Ashok Leyland is a fundamentally good stock
Hello Please review my holdings New to stocks
Hello Please review my holdings New to stocks
Which is the best free trading platform to paper trade FnO in US stock market
Bajaj Housing Finances crore IPO sets a record with bids topping lakh cr
Help Please review my portfolio and suggest if need to make some changes and also which stocks should I add Long term strategy
Help Please review my portfolio and suggest if need to make some changes and also which stocks should I add
Newbie here I made an analysis of hind zinc based on certain indicators Pls advise me if I am doing this right or not
What if harshad Mehta would have lived and participating the markets
is this successful
IPO Index Soars Startups Steal the Show
Please help to review my portfolio
Any recommendation or advice
Any recommendation or advice
Impact of Raymond Demerger on Small Shareholders
What if I have applied  lots for a IPO and then a XYZ has applied for  lot who has the highest chance of getting an allocation Whats the maths here Please share your thoughts
Root ban on groww
BPCL subsidiary BPRL secures first production concession in Abu Dhabi
this groww glitch gave me a heart attack
This groww glitch gave me a heart attack
Is my SIP doing good
BAJAJ Housing IPO HNI Category
Boat vs Oyo vs Swiggy vs Hyundai
Quant midcap downfall
Why IRB and all other railway PSUs are going down
Bajaj Housing Finance IPO  and Reliance Power IPO
Bajaj Housing Finance IPO  and Reliance Power IPO
Quotex Daily signals
Create a creative and stunning Virtual BusinessPersonal Card which can be hared using qrcode
Create Virtual Business Card Using this site it is super easy and it can be shared using QR Code
Should I sell my Qusnt funds Shady stuff seems to be happening
Holding Psu companies for passive income with dividend a good idea
Mistakes to Avoid in Your Personal Finance Journey
Update For Getting Payment On Taro Pharma M Investor Settlement
Rate my portfolio
Good news on  fronts important for the big stockmarket cashflows
Can we use someone elses UPI ID to submit IPO application
Help Me Find a Similar game changing Feature
Tata motors dvr post merger
Groww SIP mandate giving NAV after  days
Best index fund with respect to risk and returns combined"
"2024-09-12","1726099200","Bajaj housing finance IPO
How can I make my portfolio diverse Also which are good stocks now to take my portfolio to  lakh investment
What should I do
Should I sell hold or buy
IPO Index Soars Startups Steal the Show
How to check if IPO has been allotted
No confirmation for IPO application HDFC ASBA
Stocks purchased in s
How to make money from digital marketing
Aarti industries any view on this
Many Benefits Of Pumpkin Seeds
Is it okay if I dont diversify much
Can someone help me change Zerodha order screen back to what it was before please
Whats happening with Railway stocks Why are all Railway stocks down this week
TATA STEEL
Shree tirupati ipo
ETF vs FoF MF
The ultimate trading journal
HDFC Bank Shares
How will the  stock split work for VBL when I have just  share of it
Bajaj Autos Rally is crazy
Bajaj Autos rally is crazy
PC jewellers
I found a great tool
Should I hold or sell IRFC Going down since I bought it
Why so much fall in price
PRICE ERROR IN DHAN
OptionAnalytics for Nifty  Live MaxPain vs Spot Chart
Does staying in FnO more than a day create additional taxes or changes
Best Midcap Fund
NBCC
Ipo mandate request on Angel one
Newbie looking for advice
Please help me with this stock
Trafiksol IPO The GMP for this IPO indicates  listing gains but QIBinsititutions have not bid for this ipo at all What does this indicate The company is making profits too Today is last day to apply
Can someone explain me what happened to my  share after this stock split of Varun Beverage
SG Mart  Accelerating Trade in Steel and Building Products
Swiggy increases IPO size Company to now raise  crore in fresh issue up from  crore
How to Backtest My Chartlink Screener for Swing Trading Beyond the Last  Months for Free
What the hell is going on with PFC
Mutual Fund Portfolio Review
fyers nri delay in KRA validation
BAJAJ HFL IPO
Suggesting
Lifetime Free Hdfc Tata Rewards Card
Seems like all the Modi stocks under severe selling pressure
Clara industries
Travel Light Rajasthan
Different Profit Same Fund Groww vs MF Central
UJJIVAN SFB
Which indian company can be the next target of Hinderberg
Which indian company can be the next target of Hinderberg
Is one right strategy too much to ask for
Will PFC go down
Help I sold stocks for the first time and I didnt receive my money after selling the stock
Zomato PE doesnt matters    Is it still buy
UPDATE
How I made  crore in  years
Everyones got a plan until they get punched in the face In trading that punch is fear
virtual assistant companies hiring
How much percentage do you make a month on average
Holding this long term  yrs good decision
Bajaj Housing Finance IPO Results
Can I apply for SME IPO using gpay
Bajaj Housing Finance IPO Results
Whats wrong with cochin shipyard
Is this a glitch
Seeking Advice on My Portfolio Which Stocks to Keep Lose or Buy More Of
OptionAnalytics for Nifty  How is the Strongest Support and Resistance Shifting
Whats wrong with Cochin Shipyard
What do u say about this breakout stock
Breakout stock
Help
Started Investing Slowly After Some Tough Times  Need Suggestions
Review the holdings
Zomato PE doesnt matters   Take it to moon
Granules India  Buy The Dip
Whats wrong with MRPL
Views on JK Tyres  Ashok Leyland
TATA MOTORS
Anyone Here holding Sanstar
Reliance industries
Future of Adani Ports
Helppp
Is it good time to buy OIL INDIA
Suggest me a good broker
Need advice what to sell what to add what to hold
Future of Zomato
IRFC looking good
Mauj Ho gai
Am i going down with the market
Has anyone invested in unlisted shares before an IPO Thoughts platforms and selling restrictions
Varun Beverages after Stock Split
TatamotorsDVR shares
Bubbles are starting to break
Which mutual fund should i invest
RIGHT TIME TO BUY
Its too simple  not easy
Mutual fund
Its too simple  not easy
Nifty ready for  as soon as it touches k it will go back to  in  days after that
Life is all fun and all but I really want to understand at what percentage am I growing how to calculate my yearly gain percentage
Where are bears
Shree Tirupati IPO
Im cursed it went up as soon as I exited
Rate or Roast my pfolio
Do you got the allotment
Trading And Investment
Those who had bought put
NIfty Spot hit ATH but Futs Didnt why
Worth Holding IOCL
Should I exit now
Should I exit now
Correct my MF choices
Review my MF Choices
Please help me
Cant close Paytm money demat account
How I made  crore in  years
Bajaj IPO
Bajaj Finance Megathread
How I Accidentally Made a Fortune in the Stock Market
Wheres the crash
SEO Last Month Update Key Changes and Takeaways
easun rayrolle easun reyrlr  BSE
Life is all fun and game but how to know at what rate am I actually growing
Best Mutual funds screener site
New traders forgot to sell what now
The Heart Attack Groww Glitch
Groww charges
Someone explain TITAN BIOTECH
The Heart attack groww glitch
Need help in choosing mF
How I made  crore in  years
What do I do with Coffee day shares
How I made  crore in  years
How I made  crore in  years
A humble request
How I made  crore in  years
I applied to bajaj housing ipo via grow in shareholder category but i hold shares in my icici direct account of the parent company that is bajaj finance and finserv Will i not be considered in the shareholder category My grow account has my pan card linked
ETF portfolio for long term
Can someone help me change my order screen back to how it was before
Bajaj housing finance ipo
Review my mf portfolio
Saving and investing
Is your company ready for terminal growth See how CRM software can transform your success
Review my mf portfolio
Trading and Investment recap of last post
Crazy crazy world IHCL
Books
Why arent there leveraged etfs for indices
Father gave me Lakh
K for SIP
Your Thoughts on this
I need a suggestion what do you think about rajnish wellness and filatex fashion
Should we Invest in same stock IREDA
Not received Bajaj ipo nse bse email plus many loop holes across the process
I did a mistake or worth doing it
Bajaj ipo exposed how shitty this whole ipo experience is
Need help regarding PNG jwellers ipo
AA
Bajaj housing finance IPO  Kfin tech website crashed
Basant maheshwari did one rebalance today any update
SWASTIVI Swasti Vinayaka Synthetics Ltd
How to start
Can someone plz explain here how BHNI x probability is derived
How bad is it guys
Major Squeeze potential on CDZI  Big short interest but company is undervalued dramatically
Fed rate cut and impact on Indian stocks
Should I wait or sell zomato
How to make more effective our small investment with daily sip
Do you guys like this feature
Guys Thoda help krdo
will bajaj ipo grow after listing
Simple question why should capital gains be taxed differently and not same as your any other income
Amazon touched  trillion market cap
Wifi in Flights
Bajaj housing finance subscription
Repeat of Preelection Spike
Lost almost  lacs in FNO since Aug  to Aug
Bajaj Housing Finance IPO Breaks Records with x Subscription
Zerodha Kite bug led me to miss many IPOs
Bajaj housing IPO allotment time
cannot do a better silly mistake
Why do you like Angel One app
GameStop
IPO ALLOTMENT  Aaj raat bohot bhari hogi
IPO allotment Aaj raat bohot bhari hogi
I asked ChatGPT to roast rIndianStockMarket
Partner to trade
Where to invest k
Hey I am starting investing in mutual funds
ongc business cycle
Swiss banks are AntiNational
IRFC vs RVNL Which will be the future multibagger
Adani vs Hindernberg Again
Has anyone made money in Adani stocks
Kya hoga Adani ka
Bajaj Housing Finance IPO allocation to be completed today The latest GMP stepbystep guide to verify status
IPO Allotment Eligibility with Multiple Demat Accounts Need Clarification
IPO Allotment Eligibility with Multiple Demat Accounts Need Clarification
Aah shit here we go again
Nifty up  US indices up  Gold and other commodities are also up
All eyes on Bajaj housing but i am not able to open kross allotment link
Started last month for long term review
Started last month for long term review
Is allotment done
Whats the difference
What to do
Hindenburg are TRAPPED they are just Fishing here Shits gonna be FUN
Has anyone received Tolin tyres allotment
IPO not alloted
Got Kross ltd IPO
SWANENERGY
Is there a SME fund
Which funds to replace with Quant Small  Mid
What can I do If I have premium leads of Indian stock market traders
Mandate failed
Swing Trading"
