Date,UTC Date,Submission Data
"2024-09-18","1726617600","Noida Toll Rax
IPO not alloted but money not refunded
Anyone here trading in the India mkt using Stockbee scans and methodology
Open for roasting
IPO Hacks How to Increase Your Allotment Chances
Rate my portfolio
Do you think SAIL will go above  mark
Rate my portfolio
Will bajaj housing drop like ola
Why Mutual Funds Are Popular Among Investors
Transfering stocks from one demat account to other
Why QIB sub of Arkade Dev and Northern Arc so low
Fake UPI Mandates for IPOs
Returns in  Months
What are some good sources of equity research reports that focus on fundamental analysis
Why isnt my average updated
Want to start learning how to trade
Fake UPI Mandates for IPOs
Fake UPI mandates for IPOs
Is today Holiday for exchange so cant apply for ipo
Bajaj housing finance  share
Bajaj housing finance  share
Bajaj housing finance  share
Bhfl
Hold or sell
Many Benefits Of Sweet Corn
What should be the exit price before it starts hitting LC
Physical gold vs Gold fund vs gold ETFs taxation
Bajaj HF
can someone please teach me how to play finnifty
Tata Capital announced its FY results Unlisted Share
I need your help guys
Jupiter Wagons to invest Rs  crore for production capacity expansion
I am not able to buy any share today on groww Do you also facing the same problem
Portfolio Review
Why PN Gadgil is falling
MF Portfolio review
Looks like tata is not helping me
Stock Breakout after  years in Cup and handle pattern formation due to future copper demand in EV sector Power generation green energy semiconductor etc Baroda Extrusion ltd
Tbz hitting Lower circuit back to back days Hold or Sell
I wish I had more MONEY
Unable to find the entry point for ITC
BSE stock
Is it good to buy BajajHFL at  for long term  years
What happened to this one
Bought these two together around one month ago
Portfolio review
Why cant I sell stocks
Cancel my ipo in how much time my money will be unblocked
What is an ETF NFO
Tadacip  Long Time Sex
Is PNG a good buy  for the next  months
Bajaj housing finance down
Market is in all time high
Will the crude oil price rise after fed rate cut
Savers turn investors as bank deposits fall to  in  from  in  Uday Kotak
How to get IPO allotment
What do you all think about this  Should I hold for a year or just sell  Except Adani all are not that great stocks I think
Time to sell
What are your views on this stock potential in next  months
Effect of NSE IPO on BSE
Gameover
OptionAnalytics for Nifty  Live MaxPain vs Spot Chart
U error in upi mandate please help
Are ET Money Genius Stock recommendation returns misleading
Tadacip  LongTime Sex
It is satisfying when your analysis is spot on Bajaj housing
WILL BE HOLDING FOR AROUND  MONTHS ANY SUGGESTIONS
Why is Graphite India surging now
Best Share Market Advisor
best stock market advisor
Are ET Money Genius Stock recommendation returns misleading
INDIA BEST SCREEN PRINTING AND DIGITAL PRINTING INK
When will I receive ordinary shares of Tata Motors for the replacement of DVRs
Tata motors suggestion
Technical Analysis Fallacy
Pls God show mercy
Help needed with UTI Nifty  Index Fund
How does the IPO lottery work
First fo
Reliance Industries
Results of  Nifty  EarningsBased Strategy
Which upcoming IPO is you think will be most subscribed and will give best returns on listing
Negative listening with good GMP
Any idea why IT  Pharma is falling today
Views
Tadacip  Long Time Sex In Bed
OptionAnalytics for Nifty  How is the Strongest Support and Resistance Shifting
Suggestions
NBCC
Ye kon bola ki bull market chal rha hai
New ipo
My employer who is Stock Broker forcing us to close other demat accounts and declare trading activity  Mods pls dont delete
Ongoing Mainboard IPOs
Will this ever go up
Is it gonna fall a lot more Whats your prediction
I am thinking of opening new account which platform is best
Bajaj housing finance
Portfolio review
Any thoughts on Suzlon
Portfolio review
Time to liquidate
Will this go up Should I buy
For a IPO can a person apply both in Retail and Shareholder category if having eligible shares
I dont know why BSE has risen  in the past  days but
NHPC is fall atmost
Top Ultrasonic Plastic Welding Machine In India
Good price to buy Ola Electric Mobility
The bond market is screaming DANGER but nobody is listening
Best Plastic Welding Machine Manufacturers in India
Wth is happening here
Northern Arc IPO
GRAND CASCADE
Suggest me  Investing or Trading
Falling Knife or Rising Tower Indicator
Pasay Invento The Most Trusted Digital Marketing Agency in Pune
Pasay Invento The Digital Marketing Agency in Pune Driving Success
Grow Your Brand with Pasay Invento the Leading Digital Marketing Agency in Pune
Can someone help me make sense of what is happening
Achieve Digital Success with Pasay Invento the Top Digital Marketing Agency in Pune
Digital Marketing Agency in Pune
Discover Why Pasay Invento is the Best Digital Marketing Agency in Pune
When can i withdraw fund if i have sold stocks today
lakhs worth of BHFL
Top NDA Coaching Institute in India  MKC
Why Sanitizing Hand Creams Are Essential for Busy Professionals
Suggestions please
Best Pets Shop in New Delhi India  PetsDelhi
Best NoPull Dog Harness  Personalized Pet Accessories
Largest EV complaints in the world Including China
ESD Products Manufacturer and Supplier in Haryana India
India Entry Strategy
Best Lift Manufacturing Company In Guwahati Assam  Jt Group
Whats your top  performing stocks
Star Bharat Traders  Indian Spices wholesaler in Chhattisgarh India
Wanted to know how many days will it take for circuit change after coming out of ASM
In a financial crunch right now would it be okay to sell some of my gold
Whats happening with gensol
Help why are my holdings on zero dha showing blank
How less were IPOs subscrbed in
Applied ArkadeNorthernWestern ipo c u all on th sep
Sunita Solar  Solar Rooftop Contractor in Maharashtra India
Biggest fckup
CPA Firm in India
Ranjeet Plastics  Plastic Number Plate frame in Delhi
How is the FED Interest Rate cut going to affect the Indian Market
Best Pharmaceutical Company in Pune Maharashtra
Money control cashback
Best New Born Baby Accessories Manufacturer in Maharashtra India
What should be the target for Bajaj housing finance
Haryana Ceramic  Allied Products Ind In Haryana India
satlokashrambetul kabirisgod
Bhagwati Tools And Forgings  Manufacturers  Suppliers from Jalandhar Punjab
I did some research and
Festival Stocks  Newbie Here
Done with this one
Best French Language Institutes Courses for Beginners to Advanced Learners
Bought bajaj housing finance stock at
With already complaints now ola has a new challenge
Google Partner Agency in India  Webverz India
social media resources
Unallocated IPO refund delayed
social media resources
Good time to BUY
Tools for investment Research
Zero dropped ipo list What you guys think
ZAPPA TRANSPORT best global movers and packers in Switzerland
Protfolio review and suggestions
IPO checklist by zero
Pelatro Limited IPO
Shall i add any midcap MF
Have to make a portfolio for my college assignment how should I allocate the budget to make the most profitable portfolio
Price Action Trading  Technical Analysis Simplified
Watch Sant RampalJi YouTube
What is does this mean on zerodha
The US Federal Reserve is scheduled to announce its monetary policy decision at  PM India time today September
Market Basics Explained
Mukka Proteins Is it a fundamentally good stock
Is there any need for Automated Option Selling software
Portfolio review
Which chart is accurate tradingview or broker
Factful Debates Youtube Channel  visit  or Watch Sant RampalJi YouTube Channel
ZOMATO partnership with IRCTC
Ye kha pe milta he
What platforms do you use daily to help you take better decisions and trade
Want advice
Pitru Paksha         Shraddha      Pind Daan
Made  returns on my capital in the last  months
lots in  ipo Or  lots in  iposwhich could be more beneficial
Decided to Quit Need advice on my portfolio
Decided to quit stock market Need advice
Exide
What is wrong with Coin
So Fucked
Good stock
Optiontrade  OT
Penny Stock
Vested  axis bank forex help
Importance of timely exit from stock and how to determines best exit strategy
Need opinions on a few stocks
Zerodha  Spread strategy with limited margin in Zerodha
Top picks for  years
What are your views about Tata Investment Corporation Ltd
Is there any course to learn the basic of stock market on YouTube for beginners guide
US options market is crazy right now
Any feedback is appreciated
A question about buying during dips
Transfer shares from IIFL to another demat service
URGENT HELP NEEDED
Educational Teleology Discussions and Opinions required for ETFs Mutual Funds Stocks and Indices
Indian Chairman  CEO Bhaskar Panigrahi of CNTM is taking over the micro cap markets in the US and Eliminated m in debt reaching the half way mark in debttoequity conversion
ONMOBILE
image processing failed
Need suggestion for investing
What is good fundamentals
FOMC impact Nifty any
Nifty Heading Towards Correction Mode
Any stockedge user here thinking for there subscription Please review guys
How is the IPO listing price decided
Taxes on investment gains
Can we buy this stock
Portfolio since
What do swing traders do full time in the market
Swing Trading
Today i made instant exit because of some other works and went out
Bajaj Housing Finance Share Price A Complete Guide for Investors in
Half point rate cut
Respectfully is it really that difficult for anyone to share their thoughts What is the point of this space if were all just going to divide ourselves I feel like this community is only catering to the advanced or intermediate players Its disheartening Greet you all with your BEST
Fed Rate cut Sep
bp cut Wohoo
Rates Cut By  Points
BPS
Sectors in focus in Indian market after rate cuts
From  GMP to zero One BSE notice changes the game for SME IPO on listing day
Who is this guy
Multibagger Stock Baroda extrusion ltd will benefit the recent rate cuts by fed
Who is this guy
Multibagger stock Baroda extrusion ltd copper demand will benefit from fed rate cut
US Fed slashes interest rates by  bps in first cut since
DD Krystal Integrated Services Ltd
Bulls please take a deep breath
DD Krystal Integrated Services Ltd
Rate cut by  not
ka cut in the FOMC by Powell
Traps Ahead
How will US Fed rate cut affect the Indian market
Bse share price has rised a lot today Kal girne vala
Is profit in share market realised on avg price of the share Or on first bought first sold share price
Just book a order for  for Bajaj housingjust open account any trying luck I dont know anything about it Can you suggest path
Confused about Tata mtr dvd
Well not reduce taxes in old regime We are not forcing anyone to switch from the old to the new tac regime Does this statement make any sense
Top Unlisted Shares
Is t this much not expected that too in one year
Will HAL reach  by any chance
How and from where to buy unlisted shares
Tata motors
Fed rate cut is actually bad for Indian markets  how you ask let me explain
DAY  th SEP  TURNING  LAKHS TO  CRORE
Please advice which to hold and which to exit  Admin please let this go through"
"2024-09-19","1726704000","Thoughts about NTPC Green Energy
Allocation of funds in IPO  SME and NonSME
Option selling
Need a partner for stock research
HELP
Working in a company which prohibits investing directly in stocks
NTPC IPO
NIFTY IT plummeted  Yesterday
How long is this gonna go for
Northern Arc Capital Vs Arkade Developers IPO Vs Western Carriers India
Is it a good bet for long term
Many Benefits OF Custerd apple
Another GameStopbajaj
REC Limited
Need help regarding VWAP
Yesterday NTPC was on  now it reaches
Unlisted stocks
nps vatsalya
Help Regarding Finding Account
REC Limited
good entry price for HAL
Dilemma Is Using This Software the Right Choice
Whats wrong in this
Portfolio Review
REC Limited
F  What stocks I should get rid off
REC Limited
REC Limited
What do you think
MSPL Motherson Hold or Sell
What do you think
Will the market consolidate or fill the gap
Lemonn  Demat Account open kaise kare  lemonn app chages  brokerage
Wanted to start an SIP Any guide
MSPL  Hold or Sell
Why psu stocks are underperforming
What should I do Baja housing and PNGJK
Fake Breakout Kaise dekhe  Fake Chart Pettern  Support  Resistance  Tradingchartbull
Dividend
PNG hold or sell
Midcap stocks are down
Today adani trade capture  RR
Why Northern ARCs GMP decreasing
How is paytm rising despite negative fundamentals
Getting calls from Bajaj Finance after getting Bajaj Housing IPO
Help with starting a sip
My return has almost gotten to  suggest what to do should i sell IRFC  HUDCO
My Portfolio
new to stock market
Portfolio review
OptionAnalytics for Nifty  Live MaxPain vs Spot Chart
Help me
Global Automotive Aftermarket Growth USD  Bn By
Global Automotive Aftermarket Forecast USD  Bn By
CDSL as a potential next multibagger
Lower circuit
Bajaj HFL  Any thoughts on whether it would go up or continue falling down
Hudco
Wtf happened in hrs
Help me
What challenges do traders face in finding marriage partners in India
Guys whats happening today
Im here from  year From  profit to in negative and while nifty is ATH I think stock market is not for me
That Fed cut has resulted in an average  correction till mid day today What a massacre
Should I hold or exit
Negative correlation
BPCL hold or sell
Curious query about averaging
Confused
Newtons law proved right again by BHFL
Finally I think its right to book loss at
Bhai kya ho rha ye Kya karna hai
Micro cap stocks
RED ALERT
I would like to know your Opinion on these stocks  Adani Enterprises and Coal India
Nifty today
Help How do I reverse the executed sale order
Stop justifying your poor decision of buying an overvalued stock
Sell or hold
httpstmeStockIPODetails
Hindustan Aeronautics Ltd Share
Whats going on
Hold or Exit
What are the upcoming big ipos
I know I messed up way earlier But is there any solution
No profit booking nothingall the profits have been wiped out what profit booking is available herehold or exit profit reduced from  k to k
NIFTY SMALL CAP BUYING LEVELS AND NEXT TARGET
INDUSTOWER what the hell
Funds still blocked for Innomet solutions IPO
OM Traders
Once a charm now what
Lost  of my invested capital
What are some good opportunities for fresh entry in todays market decline
ChatGPT stock predictions
As usual NIFTY touches new heights yet my portifolio goes down
Kotak Securities is the worst broker
Should I hold or sell PN Gadgil Jewellers Stock I received its IPO and sold off  of my holdings but kept  in expectation of price increase during Diwali
Big billion day sale on nse today
NIFTY SMALL CAP BUYING LEVELS AND NEXT TARGET
Shivalic Power Control
ka target dikha kar retail ka chuna laga diya
Do anyone wants to share their smallcase fees
Did I catch a falling knife
Beginner here please advice and rate my portfolio
Did I catch a falling knife
Brazil Airbag Systems Market Report Trends Share Forecast
Portfolio review
For upcoming IPOs which stock one should buy to be eligible in shareholder quota
Thoughts on this
Future of Yes Bank and phonePe is still using Yes Bank Need your thoughts on this
OptionAnalytics for Nifty  How is the Strongest Support and Resistance Shifting
Which stock are you buying today
providence Fashion Embracing Style Sustainability and Affordability
Vodafone waalon
IRFC shares  To hold for long term or to Sell
Has anyone tried entri elevate apps stock market course
Isnt Indias Bull Market Slowing and Heading Toward a Crash Like Chinas
Understanding how to sell the stocks and the time frame
need some help with shareholder quota for ipo
Invested in suzlon energy
Can anyone with good understanding of market tell me can we buy Praj industries share today or is it likely to correct more going ahead
What the hell is this A stock surge or a chart glitch
Psu
NHPC is dying on me Hold or book loss
PNG Should I book the remaining profit or hold till DussheraDiwali
Is it strong opportunity to buy BHFL or should we wait more for more DIP
Northern arc GMP
What the hell is this A stock surge or a chart glitch
Stock split
Upcoming ipo shareholder quota
How to Split and Invest My Joining Bonus for Maximum Returns
Bloodbath in the market Massacre bitch please
Glitch or surge
Searching for a better app
Mysterious stock surge or a chart glitch
Mysterious stock surge or a chart glitch
to  Mysterious stock surge or just a technical glitch
to  Mysterious stock surge or just a technical glitch
What should I do
Hold or sell RVNL
Rate Cuts are here  Correction Incoming
Happiest mind
Small case company
Update on gold trading
Hedging for a  lakh equity market portfolio
What do I do here Im a total fresher should I increase or decrease monthly amount or add in new MFs
Please help me
Groww isnt showing my balance
Please help me
Mutual funds advice
What do you think cause mid and small caps selloff after rate cuts
RIR Power Electronics
Short straddle
Is Dr Reddys at a good valuation currently
TechFlod Leads tool
XAUUSD SELL
Nifty  intraday trading plan conversation
L Lag gaye It seems no business is safe from them
Whys your pf down and what can be done for a good sustainable growth
Thoughts on waaree renewable energy
Applied  lots with different demats
Tata chemicals good for swing be ready to fly with it
Goal based investing
I am F one month since I started Investing  My finance degree feels useless
EY India boss on employee Anna Sebastian Perayils death Dont believe work pressure claimed her life
Im F  One month since I started investing and my finance degree feels useless How can I learn
Mutual fund portfolio review
ZAPPA TRANSPORT best movers and packers
RSI divergence A different approach
Clara industries
L bet
Swiggy CCPS
Suggest SIP for
Shareholder Quota
Is it a good time to yr take fresh enteries into TCS HDFC Bank ICICI Bank and Kotak Mahindra Bank I had sold them previously due to not giving decent returns in the past
Options trading
CrossBorder Share Swaps
Need help
Indian CEO of CNTM eliminates m in debt reaching halfway mark in debttoequity conversion  Will also now benefit with the feds new solar interest rate cut
What about taxes
Thoughts and opinions
Is Tata motors good buy
Should I hold on to my railway and renewable energy stocks long term
Thoughts on BEL
Anyone who have invested in MCI Electronics
What is happening to TCS why it is falling
Judge all you want
Planning to buy the whole market Whats my best option
CAMPUS A Price action lesson
Nasdaq up almost
Intraday breakout for  Eicher motors and maruti Suzuki
Which smallcase do you invest in
Coal India analysis as asked how got  digit targets
I Want Tradeing Friends
Adani Power
HAL most searched stock between retailers heres the analysis
LOVABLE LINGERIE LTD a multibagger stock
Please tell what should I do  Hold or sell
Invested in suzlon energy
Abhi bhi mauka hai Bajaj Housing me guys  Target Price
Want some help
Not bad returns for  days Has corrected  today I urge you guys to take a look again If it goes to  levels the price starts making sense
USA Bio secure act  will it benefit Indian CDMO and CRAM players
Whats the last date to become a shareholder of ntpc so that I am considered in shareholder Quota of ntpc green Can someone suggest a website where I can check that
Recession is coming Ahead  Put a reminder on this post
What was the reason for the Fed rate cut in  vs now in   bps Are the scenarios different or similar
Would it be wise to buy vodafone after the downfall at
What about these  stocks
Im holding Vodafone Idea lets  go Whats your hot take
Review my MF choices for SIP
Biggest Crash is coming in  Heres Why
Biggest Crash is coming in  Heres Why
Biggest Crash is coming in  Heres Why
Name community trading groups in India If any
One of The Hidden Gem In indian market
One of the Hidden Gem  in Indian Market
Amazon Could Buy This Indian EV Startup Amazon CTOs mystery visit to Ultraviolette
Check Out the Spikes After  PM on the Last  Nifty Expiries
any good mid or small cap pharma companies stock with strong fundamentals
Another Softbank Backed Massive Loss Making Company Swiggy Filing For IPO This Week Plans To Pass Their Losses To The Retail Investors
shares as a gift
What email id does sharekhan use to share contract notes
NEOGEN CHEMICALS Stock Update Using Risological
PLEASE HAVE A LOOK REQUEST FROM YOUR JUNIOR
Mutual funds to invest in from a long term perspectives
Didnt get Bajaj Housing Finance IPO allotment but amount is still blocked
Need to exit stock market is it the right time
Great concept of what is value investing
This time it will be different
Stree  now the highest grossing Hindi movies of all time amazing when you consider its ticket prices were less than half of Jawan type movies This should signal a new era of content based movies in India
Failed UPI transaction
Failed UPI transaction"
